{
  "id": "humanoid",
  "version": 1,
  "root": "torso",
  "parts": {
    "torso":     { "parent": null,        "w": 60, "h": 90, "anchor": [30, 90], "attachAt": [0, -50], "restRot": 0,  "z": 0,  "placeholderColor": [200, 100, 100, 220] },
    "head":      { "parent": "torso",     "w": 50, "h": 50, "anchor": [25, 50], "attachAt": [30, 0],  "restRot": 0,  "z": 1,  "placeholderColor": [230, 200, 160, 230] },
    "upperArmL": { "parent": "torso",     "w": 18, "h": 40, "anchor": [9, 4],   "attachAt": [8, 12],  "restRot": 0,  "z": -1, "placeholderColor": [100, 130, 200, 220] },
    "lowerArmL": { "parent": "upperArmL", "w": 16, "h": 38, "anchor": [8, 4],   "attachAt": [9, 36],  "restRot": 0,  "z": -1, "placeholderColor": [80, 110, 180, 220] },
    "handL":     { "parent": "lowerArmL", "w": 14, "h": 14, "anchor": [7, 2],   "attachAt": [8, 36],  "restRot": 0,  "z": -1, "placeholderColor": [230, 200, 160, 230] },
    "upperArmR": { "parent": "torso",     "w": 18, "h": 40, "anchor": [9, 4],   "attachAt": [52, 12], "restRot": 0,  "z": 2,  "placeholderColor": [100, 130, 200, 220] },
    "lowerArmR": { "parent": "upperArmR", "w": 16, "h": 38, "anchor": [8, 4],   "attachAt": [9, 36],  "restRot": 0,  "z": 2,  "placeholderColor": [80, 110, 180, 220] },
    "handR":     { "parent": "lowerArmR", "w": 14, "h": 14, "anchor": [7, 2],   "attachAt": [8, 36],  "restRot": 0,  "z": 2,  "placeholderColor": [230, 200, 160, 230] },
    "thighL":    { "parent": "torso",     "w": 20, "h": 44, "anchor": [10, 4],  "attachAt": [18, 86], "restRot": 0,  "z": -1, "placeholderColor": [80, 80, 100, 220] },
    "shinL":     { "parent": "thighL",    "w": 18, "h": 42, "anchor": [9, 4],   "attachAt": [10, 40], "restRot": 0,  "z": -1, "placeholderColor": [60, 60, 80, 220] },
    "footL":     { "parent": "shinL",     "w": 24, "h": 12, "anchor": [8, 2],   "attachAt": [9, 38],  "restRot": 0,  "z": -1, "placeholderColor": [50, 40, 30, 220] },
    "thighR":    { "parent": "torso",     "w": 20, "h": 44, "anchor": [10, 4],  "attachAt": [42, 86], "restRot": 0,  "z": -1, "placeholderColor": [80, 80, 100, 220] },
    "shinR":     { "parent": "thighR",    "w": 18, "h": 42, "anchor": [9, 4],   "attachAt": [10, 40], "restRot": 0,  "z": -1, "placeholderColor": [60, 60, 80, 220] },
    "footR":     { "parent": "shinR",     "w": 24, "h": 12, "anchor": [8, 2],   "attachAt": [9, 38],  "restRot": 0,  "z": -1, "placeholderColor": [50, 40, 30, 220] }
  }
}
