{
  "id": "civilian_f",
  "version": 1,
  "root": "torso",
  "parts": {
    "torso": {
      "parent": null,
      "w": 98,
      "h": 138,
      "anchor": [
        48,
        135
      ],
      "attachAt": [
        0,
        0
      ],
      "restRot": 0,
      "z": 0,
      "png": "civilian_f/parts/torso.png"
    },
    "head": {
      "parent": "torso",
      "w": 120,
      "h": 138,
      "anchor": [
        58,
        130
      ],
      "attachAt": [
        48,
        0
      ],
      "restRot": 0,
      "z": 1,
      "png": "civilian_f/parts/head.png"
    },
    "upperArmL": {
      "parent": "torso",
      "w": 45,
      "h": 75,
      "anchor": [
        40,
        3
      ],
      "attachAt": [
        20,
        18
      ],
      "restRot": 0,
      "z": 2,
      "png": "civilian_f/parts/upperArmL.png"
    },
    "lowerArmL": {
      "parent": "upperArmL",
      "w": 45,
      "h": 70,
      "anchor": [
        30,
        0
      ],
      "attachAt": [
        30,
        70
      ],
      "restRot": 0,
      "z": 2,
      "png": "civilian_f/parts/lowerArmL.png"
    },
    "handL": {
      "parent": "lowerArmL",
      "w": 35,
      "h": 35,
      "anchor": [
        15,
        0
      ],
      "attachAt": [
        25,
        60
      ],
      "restRot": 0,
      "z": 2,
      "png": "civilian_f/parts/handL.png"
    },
    "upperArmR": {
      "parent": "torso",
      "w": 50,
      "h": 75,
      "anchor": [
        5,
        3
      ],
      "attachAt": [
        80,
        18
      ],
      "restRot": 0,
      "z": 2,
      "png": "civilian_f/parts/upperArmR.png"
    },
    "lowerArmR": {
      "parent": "upperArmR",
      "w": 50,
      "h": 70,
      "anchor": [
        15,
        0
      ],
      "attachAt": [
        15,
        70
      ],
      "restRot": 0,
      "z": 2,
      "png": "civilian_f/parts/lowerArmR.png"
    },
    "handR": {
      "parent": "lowerArmR",
      "w": 40,
      "h": 35,
      "anchor": [
        15,
        0
      ],
      "attachAt": [
        20,
        60
      ],
      "restRot": 0,
      "z": 2,
      "png": "civilian_f/parts/handR.png"
    },
    "thighL": {
      "parent": "torso",
      "w": 45,
      "h": 105,
      "anchor": [
        20,
        10
      ],
      "attachAt": [
        35,
        135
      ],
      "restRot": 0,
      "z": -2,
      "png": "civilian_f/parts/thighL.png"
    },
    "shinL": {
      "parent": "thighL",
      "w": 45,
      "h": 95,
      "anchor": [
        20,
        5
      ],
      "attachAt": [
        20,
        100
      ],
      "restRot": 0,
      "z": -2,
      "png": "civilian_f/parts/shinL.png"
    },
    "footL": {
      "parent": "shinL",
      "w": 55,
      "h": 40,
      "anchor": [
        25,
        5
      ],
      "attachAt": [
        20,
        90
      ],
      "restRot": 0,
      "z": -2,
      "png": "civilian_f/parts/footL.png"
    },
    "thighR": {
      "parent": "torso",
      "w": 45,
      "h": 105,
      "anchor": [
        17,
        10
      ],
      "attachAt": [
        62,
        135
      ],
      "restRot": 0,
      "z": -2,
      "png": "civilian_f/parts/thighR.png"
    },
    "shinR": {
      "parent": "thighR",
      "w": 45,
      "h": 95,
      "anchor": [
        17,
        5
      ],
      "attachAt": [
        17,
        100
      ],
      "restRot": 0,
      "z": -2,
      "png": "civilian_f/parts/shinR.png"
    },
    "footR": {
      "parent": "shinR",
      "w": 55,
      "h": 40,
      "anchor": [
        28,
        5
      ],
      "attachAt": [
        22,
        90
      ],
      "restRot": 0,
      "z": -2,
      "png": "civilian_f/parts/footR.png"
    }
  }
}
